[
  {
    "id": "achari-aloo",
    "slug": "achari-aloo",
    "name": "Achari Aloo",
    "description": "Potatoes cooked with onions, tomatoes & pickling spices.",
    "categories": ["vegetable-dishes"],
    "prices": [
      { "context": "main", "amount": 12.50 },
      { "context": "side", "amount": 6.95 }
    ],
    "currency": "GBP",
    "spiceLevel": 2,
    "dietary": ["vegetarian", "gluten-free"],
    "allergens": [],
    "available": true,
    "sortOrder": 1,
    "imageRef": null,
    "imageAlt": null,
    "featured": false,
    "seasonal": false,
    "soldOut": false
  },
  {
    "id": "paneer-karahi",
    "slug": "paneer-karahi",
    "name": "Paneer Karahi",
    "description": "Fresh homemade cheese cooked with bell pepper, onion and tomato.",
    "categories": ["vegetable-dishes"],
    "prices": [
      { "context": "main", "amount": 12.50 },
      { "context": "side", "amount": 6.95 }
    ],
    "currency": "GBP",
    "spiceLevel": 2,
    "dietary": ["vegetarian"],
    "allergens": [],
    "available": true,
    "sortOrder": 2,
    "imageRef": null,
    "imageAlt": null,
    "featured": false,
    "seasonal": false,
    "soldOut": false
  },
  {
    "id": "chana-masala",
    "slug": "chana-masala",
    "name": "Chana Masala",
    "description": "Chickpeas, tomatoes and onions with a tempering of cumin.",
    "categories": ["vegetable-dishes"],
    "prices": [
      { "context": "main", "amount": 12.50 },
      { "context": "side", "amount": 6.95 }
    ],
    "currency": "GBP",
    "spiceLevel": 2,
    "dietary": ["vegetarian", "vegan", "gluten-free"],
    "allergens": [],
    "available": true,
    "sortOrder": 3,
    "imageRef": null,
    "imageAlt": null,
    "featured": false,
    "seasonal": false,
    "soldOut": false
  },
  {
    "id": "dal-makhani",
    "slug": "dal-makhani",
    "name": "Dal Makhani",
    "description": "Whole black lentils cooked overnight on a very slow heat, finished with churned butter and fresh cream.",
    "categories": ["vegetable-dishes"],
    "prices": [
      { "context": "main", "amount": 12.50 },
      { "context": "side", "amount": 6.95 }
    ],
    "currency": "GBP",
    "spiceLevel": 1,
    "dietary": ["vegetarian", "gluten-free"],
    "allergens": [],
    "available": true,
    "sortOrder": 4,
    "imageRef": null,
    "imageAlt": null,
    "featured": false,
    "seasonal": false,
    "soldOut": false
  },
  {
    "id": "dal-tarka",
    "slug": "dal-tarka",
    "name": "Dal Tarka",
    "description": "Spiced yellow lentil tempered with onions, garlic and fresh coriander.",
    "categories": ["vegetable-dishes"],
    "prices": [
      { "context": "main", "amount": 12.50 },
      { "context": "side", "amount": 6.95 }
    ],
    "currency": "GBP",
    "spiceLevel": 1,
    "dietary": ["vegetarian", "vegan", "gluten-free"],
    "allergens": [],
    "available": true,
    "sortOrder": 5,
    "imageRef": null,
    "imageAlt": null,
    "featured": false,
    "seasonal": false,
    "soldOut": false
  },
  {
    "id": "gobhi-aloo",
    "slug": "gobhi-aloo",
    "name": "Gobhi Aloo",
    "description": "Cauliflower and potato cooked with a tomato based sauce.",
    "categories": ["vegetable-dishes"],
    "prices": [
      { "context": "main", "amount": 12.50 },
      { "context": "side", "amount": 6.95 }
    ],
    "currency": "GBP",
    "spiceLevel": 2,
    "dietary": ["vegetarian", "vegan", "gluten-free"],
    "allergens": [],
    "available": true,
    "sortOrder": 6,
    "imageRef": null,
    "imageAlt": null,
    "featured": false,
    "seasonal": false,
    "soldOut": false
  },
  {
    "id": "brinjal-masala",
    "slug": "brinjal-masala",
    "name": "Brinjal Masala",
    "description": "Aubergine in an onion and tomato based sauce.",
    "categories": ["vegetable-dishes"],
    "prices": [
      { "context": "main", "amount": 12.50 },
      { "context": "side", "amount": 6.95 }
    ],
    "currency": "GBP",
    "spiceLevel": 2,
    "dietary": ["vegetarian", "vegan", "gluten-free"],
    "allergens": [],
    "available": true,
    "sortOrder": 7,
    "imageRef": null,
    "imageAlt": null,
    "featured": false,
    "seasonal": false,
    "soldOut": false
  },
  {
    "id": "mushroom-bhaji",
    "slug": "mushroom-bhaji",
    "name": "Mushroom Bhaji",
    "description": "Spiced mushroom curry with onion, tomato, ginger and garlic.",
    "categories": ["vegetable-dishes"],
    "prices": [
      { "context": "main", "amount": 12.50 },
      { "context": "side", "amount": 6.95 }
    ],
    "currency": "GBP",
    "spiceLevel": 2,
    "dietary": ["vegetarian", "vegan", "gluten-free"],
    "allergens": [],
    "available": true,
    "sortOrder": 8,
    "imageRef": null,
    "imageAlt": null,
    "featured": false,
    "seasonal": false,
    "soldOut": false
  },
  {
    "id": "mixed-vegetable-takatak",
    "slug": "mixed-vegetable-takatak",
    "name": "Mixed Vegetable Takatak",
    "description": "Seasonal vegetables marinated and cooked on the griddle with onion, tomato and chaat masala.",
    "categories": ["vegetable-dishes"],
    "prices": [
      { "context": "main", "amount": 12.50 },
      { "context": "side", "amount": 6.95 }
    ],
    "currency": "GBP",
    "spiceLevel": 2,
    "dietary": ["vegetarian", "vegan"],
    "allergens": [],
    "available": true,
    "sortOrder": 9,
    "imageRef": null,
    "imageAlt": null,
    "featured": false,
    "seasonal": false,
    "soldOut": false
  },
  {
    "id": "paneer-butter-masala",
    "slug": "paneer-butter-masala",
    "name": "Paneer Butter Masala",
    "description": "Homemade cheese cubed with cashew nuts, cooked in a warming tomato masala sauce.",
    "categories": ["vegetable-dishes"],
    "prices": [
      { "context": "main", "amount": 12.50 },
      { "context": "side", "amount": 6.95 }
    ],
    "currency": "GBP",
    "spiceLevel": 1,
    "dietary": ["vegetarian"],
    "allergens": [],
    "available": true,
    "sortOrder": 10,
    "imageRef": null,
    "imageAlt": null,
    "featured": false,
    "seasonal": false,
    "soldOut": false
  },
  {
    "id": "mattar-green-peas",
    "slug": "mattar-green-peas",
    "name": "Mattar (Green Peas)",
    "description": "A curry with green pea and your choice of aloo (potato), paneer (homemade cheese) or mushroom. Finished with cashew nuts and onion tomato sauce.",
    "categories": ["vegetable-dishes"],
    "prices": [
      { "context": "main", "amount": 12.50 },
      { "context": "side", "amount": 6.95 }
    ],
    "currency": "GBP",
    "spiceLevel": 2,
    "dietary": ["vegetarian"],
    "allergens": [],
    "available": true,
    "sortOrder": 11,
    "imageRef": null,
    "imageAlt": null,
    "featured": false,
    "seasonal": false,
    "soldOut": false,
    "modifiers": ["add-paneer", "add-mushroom"]
  },
  {
    "id": "saag-spinach",
    "slug": "saag-spinach",
    "name": "Saag (Spinach)",
    "description": "A spinach, garlic and tempered cumin sauce with your choice of aloo (potato), paneer (homemade cheese) or mushroom.",
    "categories": ["vegetable-dishes"],
    "prices": [
      { "context": "main", "amount": 12.50 },
      { "context": "side", "amount": 6.95 }
    ],
    "currency": "GBP",
    "spiceLevel": 2,
    "dietary": ["vegetarian"],
    "allergens": [],
    "available": true,
    "sortOrder": 12,
    "imageRef": null,
    "imageAlt": null,
    "featured": false,
    "seasonal": false,
    "soldOut": false,
    "modifiers": ["add-paneer", "add-mushroom"]
  },
  {
    "id": "paneer-makhani",
    "slug": "paneer-makhani",
    "name": "Paneer Makhani",
    "description": "Homemade Indian cheese cooked in a tomato based gravy with cream, cashew nuts, and honey.",
    "categories": ["vegetable-dishes"],
    "prices": [
      { "context": "main", "amount": 12.50 },
      { "context": "side", "amount": 6.95 }
    ],
    "currency": "GBP",
    "spiceLevel": 1,
    "dietary": ["vegetarian"],
    "allergens": [],
    "available": true,
    "sortOrder": 13,
    "imageRef": null,
    "imageAlt": null,
    "featured": false,
    "seasonal": false,
    "soldOut": false
  }
]
