[
  {
    "id": "plain-naan",
    "slug": "plain-naan",
    "name": "Plain Naan",
    "description": null,
    "categories": ["breads"],
    "prices": [
      { "context": "standard", "amount": 3.50 }
    ],
    "currency": "GBP",
    "spiceLevel": 0,
    "dietary": ["vegetarian"],
    "allergens": [],
    "available": true,
    "sortOrder": 1,
    "imageRef": null,
    "imageAlt": null,
    "featured": false,
    "seasonal": false,
    "soldOut": false
  },
  {
    "id": "garlic-naan",
    "slug": "garlic-naan",
    "name": "Garlic Naan",
    "description": null,
    "categories": ["breads"],
    "prices": [
      { "context": "standard", "amount": 3.95 }
    ],
    "currency": "GBP",
    "spiceLevel": 0,
    "dietary": ["vegetarian"],
    "allergens": [],
    "available": true,
    "sortOrder": 2,
    "imageRef": null,
    "imageAlt": null,
    "featured": false,
    "seasonal": false,
    "soldOut": false
  },
  {
    "id": "butter-naan",
    "slug": "butter-naan",
    "name": "Butter Naan",
    "description": null,
    "categories": ["breads"],
    "prices": [
      { "context": "standard", "amount": 3.95 }
    ],
    "currency": "GBP",
    "spiceLevel": 0,
    "dietary": ["vegetarian"],
    "allergens": [],
    "available": true,
    "sortOrder": 3,
    "imageRef": null,
    "imageAlt": null,
    "featured": false,
    "seasonal": false,
    "soldOut": false
  },
  {
    "id": "peshwari-naan",
    "slug": "peshwari-naan",
    "name": "Peshwari Naan",
    "description": null,
    "categories": ["breads"],
    "prices": [
      { "context": "standard", "amount": 3.95 }
    ],
    "currency": "GBP",
    "spiceLevel": 0,
    "dietary": ["vegetarian"],
    "allergens": [],
    "available": true,
    "sortOrder": 4,
    "imageRef": null,
    "imageAlt": null,
    "featured": false,
    "seasonal": false,
    "soldOut": false
  },
  {
    "id": "cheese-naan",
    "slug": "cheese-naan",
    "name": "Cheese Naan",
    "description": null,
    "categories": ["breads"],
    "prices": [
      { "context": "standard", "amount": 3.95 }
    ],
    "currency": "GBP",
    "spiceLevel": 0,
    "dietary": ["vegetarian"],
    "allergens": [],
    "available": true,
    "sortOrder": 5,
    "imageRef": null,
    "imageAlt": null,
    "featured": false,
    "seasonal": false,
    "soldOut": false
  },
  {
    "id": "keema-naan",
    "slug": "keema-naan",
    "name": "Keema Naan",
    "description": null,
    "categories": ["breads"],
    "prices": [
      { "context": "standard", "amount": 4.25 }
    ],
    "currency": "GBP",
    "spiceLevel": 0,
    "dietary": [],
    "allergens": [],
    "available": true,
    "sortOrder": 6,
    "imageRef": null,
    "imageAlt": null,
    "featured": false,
    "seasonal": false,
    "soldOut": false
  },
  {
    "id": "tandoori-roti",
    "slug": "tandoori-roti",
    "name": "Tandoori Roti",
    "description": null,
    "categories": ["breads"],
    "prices": [
      { "context": "standard", "amount": 2.95 }
    ],
    "currency": "GBP",
    "spiceLevel": 0,
    "dietary": ["vegetarian"],
    "allergens": [],
    "available": true,
    "sortOrder": 7,
    "imageRef": null,
    "imageAlt": null,
    "featured": false,
    "seasonal": false,
    "soldOut": false
  },
  {
    "id": "butter-roti",
    "slug": "butter-roti",
    "name": "Butter Roti",
    "description": null,
    "categories": ["breads"],
    "prices": [
      { "context": "standard", "amount": 3.25 }
    ],
    "currency": "GBP",
    "spiceLevel": 0,
    "dietary": ["vegetarian"],
    "allergens": [],
    "available": true,
    "sortOrder": 8,
    "imageRef": null,
    "imageAlt": null,
    "featured": false,
    "seasonal": false,
    "soldOut": false
  },
  {
    "id": "chapati",
    "slug": "chapati",
    "name": "Chapati",
    "description": null,
    "categories": ["breads"],
    "prices": [
      { "context": "standard", "amount": 2.95 }
    ],
    "currency": "GBP",
    "spiceLevel": 0,
    "dietary": ["vegetarian"],
    "allergens": [],
    "available": true,
    "sortOrder": 9,
    "imageRef": null,
    "imageAlt": null,
    "featured": false,
    "seasonal": false,
    "soldOut": false
  },
  {
    "id": "butter-chapati",
    "slug": "butter-chapati",
    "name": "Butter Chapati",
    "description": null,
    "categories": ["breads"],
    "prices": [
      { "context": "standard", "amount": 3.50 }
    ],
    "currency": "GBP",
    "spiceLevel": 0,
    "dietary": ["vegetarian"],
    "allergens": [],
    "available": true,
    "sortOrder": 10,
    "imageRef": null,
    "imageAlt": null,
    "featured": false,
    "seasonal": false,
    "soldOut": false
  },
  {
    "id": "tawa-paratha",
    "slug": "tawa-paratha",
    "name": "Tawa Paratha",
    "description": null,
    "categories": ["breads"],
    "prices": [
      { "context": "standard", "amount": 3.95 }
    ],
    "currency": "GBP",
    "spiceLevel": 0,
    "dietary": ["vegetarian"],
    "allergens": [],
    "available": true,
    "sortOrder": 11,
    "imageRef": null,
    "imageAlt": null,
    "featured": false,
    "seasonal": false,
    "soldOut": false
  }
]
