[
  {
    "id": "kids-caprisun",
    "slug": "kids-caprisun",
    "name": "Caprisun",
    "description": null,
    "categories": ["kids"],
    "prices": [
      { "context": "standard", "amount": 1.95 }
    ],
    "currency": "GBP",
    "spiceLevel": 0,
    "dietary": ["vegan", "gluten-free"],
    "allergens": [],
    "available": true,
    "sortOrder": 1,
    "imageRef": null,
    "imageAlt": null,
    "featured": false,
    "seasonal": false,
    "soldOut": false
  },
  {
    "id": "kids-appletizer",
    "slug": "kids-appletizer",
    "name": "Appletizer",
    "description": null,
    "categories": ["kids"],
    "prices": [
      { "context": "standard", "amount": 2.25 }
    ],
    "currency": "GBP",
    "spiceLevel": 0,
    "dietary": ["vegan", "gluten-free"],
    "allergens": [],
    "available": true,
    "sortOrder": 2,
    "imageRef": null,
    "imageAlt": null,
    "featured": false,
    "seasonal": false,
    "soldOut": false
  },
  {
    "id": "kids-apple-juice",
    "slug": "kids-apple-juice",
    "name": "Apple Juice",
    "description": null,
    "categories": ["kids"],
    "prices": [
      { "context": "standard", "amount": 1.95 }
    ],
    "currency": "GBP",
    "spiceLevel": 0,
    "dietary": ["vegan", "gluten-free"],
    "allergens": [],
    "available": true,
    "sortOrder": 3,
    "imageRef": null,
    "imageAlt": null,
    "featured": false,
    "seasonal": false,
    "soldOut": false
  },
  {
    "id": "kids-orange-juice",
    "slug": "kids-orange-juice",
    "name": "Orange Juice",
    "description": null,
    "categories": ["kids"],
    "prices": [
      { "context": "standard", "amount": 1.95 }
    ],
    "currency": "GBP",
    "spiceLevel": 0,
    "dietary": ["vegan", "gluten-free"],
    "allergens": [],
    "available": true,
    "sortOrder": 4,
    "imageRef": null,
    "imageAlt": null,
    "featured": false,
    "seasonal": false,
    "soldOut": false
  },
  {
    "id": "kids-lassi",
    "slug": "kids-lassi",
    "name": "Kids Lassi",
    "description": null,
    "categories": ["kids"],
    "prices": [
      { "context": "standard", "amount": 1.95 }
    ],
    "currency": "GBP",
    "spiceLevel": 0,
    "dietary": ["vegetarian", "gluten-free"],
    "allergens": [],
    "available": true,
    "sortOrder": 5,
    "imageRef": null,
    "imageAlt": null,
    "featured": false,
    "seasonal": false,
    "soldOut": false
  }
]
