[
  {
    "id": "coke",
    "slug": "coke",
    "name": "Coke",
    "description": null,
    "categories": ["drinks"],
    "prices": [
      { "context": "standard", "amount": 3.45 }
    ],
    "currency": "GBP",
    "spiceLevel": 0,
    "dietary": ["vegan", "gluten-free"],
    "allergens": [],
    "available": true,
    "sortOrder": 1,
    "imageRef": null,
    "imageAlt": null,
    "featured": false,
    "seasonal": false,
    "soldOut": false,
    "size": "330ml"
  },
  {
    "id": "diet-coke",
    "slug": "diet-coke",
    "name": "Diet Coke",
    "description": null,
    "categories": ["drinks"],
    "prices": [
      { "context": "standard", "amount": 3.45 }
    ],
    "currency": "GBP",
    "spiceLevel": 0,
    "dietary": ["vegan", "gluten-free"],
    "allergens": [],
    "available": true,
    "sortOrder": 2,
    "imageRef": null,
    "imageAlt": null,
    "featured": false,
    "seasonal": false,
    "soldOut": false,
    "size": "330ml"
  },
  {
    "id": "coke-zero",
    "slug": "coke-zero",
    "name": "Coke Zero",
    "description": null,
    "categories": ["drinks"],
    "prices": [
      { "context": "standard", "amount": 3.45 }
    ],
    "currency": "GBP",
    "spiceLevel": 0,
    "dietary": ["vegan", "gluten-free"],
    "allergens": [],
    "available": true,
    "sortOrder": 3,
    "imageRef": null,
    "imageAlt": null,
    "featured": false,
    "seasonal": false,
    "soldOut": false,
    "size": "330ml"
  },
  {
    "id": "fanta",
    "slug": "fanta",
    "name": "Fanta",
    "description": null,
    "categories": ["drinks"],
    "prices": [
      { "context": "standard", "amount": 3.45 }
    ],
    "currency": "GBP",
    "spiceLevel": 0,
    "dietary": ["vegan", "gluten-free"],
    "allergens": [],
    "available": true,
    "sortOrder": 4,
    "imageRef": null,
    "imageAlt": null,
    "featured": false,
    "seasonal": false,
    "soldOut": false,
    "size": "330ml"
  },
  {
    "id": "sprite",
    "slug": "sprite",
    "name": "Sprite",
    "description": null,
    "categories": ["drinks"],
    "prices": [
      { "context": "standard", "amount": 3.45 }
    ],
    "currency": "GBP",
    "spiceLevel": 0,
    "dietary": ["vegan", "gluten-free"],
    "allergens": [],
    "available": true,
    "sortOrder": 5,
    "imageRef": null,
    "imageAlt": null,
    "featured": false,
    "seasonal": false,
    "soldOut": false,
    "size": "330ml"
  },
  {
    "id": "irn-bru",
    "slug": "irn-bru",
    "name": "Irn Bru",
    "description": null,
    "categories": ["drinks"],
    "prices": [
      { "context": "standard", "amount": 3.45 }
    ],
    "currency": "GBP",
    "spiceLevel": 0,
    "dietary": ["vegan", "gluten-free"],
    "allergens": [],
    "available": true,
    "sortOrder": 6,
    "imageRef": null,
    "imageAlt": null,
    "featured": false,
    "seasonal": false,
    "soldOut": false,
    "size": "330ml"
  },
  {
    "id": "mineral-water-s",
    "slug": "mineral-water-s",
    "name": "Mineral Water",
    "description": null,
    "categories": ["drinks"],
    "prices": [
      { "context": "standard", "amount": 3.35 }
    ],
    "currency": "GBP",
    "spiceLevel": 0,
    "dietary": ["vegan", "gluten-free"],
    "allergens": [],
    "available": true,
    "sortOrder": 7,
    "imageRef": null,
    "imageAlt": null,
    "featured": false,
    "seasonal": false,
    "soldOut": false,
    "size": "Small"
  },
  {
    "id": "mineral-water-l",
    "slug": "mineral-water-l",
    "name": "Mineral Water",
    "description": null,
    "categories": ["drinks"],
    "prices": [
      { "context": "standard", "amount": 5.45 }
    ],
    "currency": "GBP",
    "spiceLevel": 0,
    "dietary": ["vegan", "gluten-free"],
    "allergens": [],
    "available": true,
    "sortOrder": 8,
    "imageRef": null,
    "imageAlt": null,
    "featured": false,
    "seasonal": false,
    "soldOut": false,
    "size": "Large"
  },
  {
    "id": "sparkling-water-s",
    "slug": "sparkling-water-s",
    "name": "Sparkling Water",
    "description": null,
    "categories": ["drinks"],
    "prices": [
      { "context": "standard", "amount": 3.35 }
    ],
    "currency": "GBP",
    "spiceLevel": 0,
    "dietary": ["vegan", "gluten-free"],
    "allergens": [],
    "available": true,
    "sortOrder": 9,
    "imageRef": null,
    "imageAlt": null,
    "featured": false,
    "seasonal": false,
    "soldOut": false,
    "size": "Small"
  },
  {
    "id": "sparkling-water-l",
    "slug": "sparkling-water-l",
    "name": "Sparkling Water",
    "description": null,
    "categories": ["drinks"],
    "prices": [
      { "context": "standard", "amount": 5.45 }
    ],
    "currency": "GBP",
    "spiceLevel": 0,
    "dietary": ["vegan", "gluten-free"],
    "allergens": [],
    "available": true,
    "sortOrder": 10,
    "imageRef": null,
    "imageAlt": null,
    "featured": false,
    "seasonal": false,
    "soldOut": false,
    "size": "Large"
  },
  {
    "id": "soda",
    "slug": "soda",
    "name": "Soda",
    "description": null,
    "categories": ["drinks"],
    "prices": [
      { "context": "standard", "amount": 3.45 }
    ],
    "currency": "GBP",
    "spiceLevel": 0,
    "dietary": ["vegan", "gluten-free"],
    "allergens": [],
    "available": true,
    "sortOrder": 11,
    "imageRef": null,
    "imageAlt": null,
    "featured": false,
    "seasonal": false,
    "soldOut": false
  },
  {
    "id": "lime-cordial",
    "slug": "lime-cordial",
    "name": "Lime Cordial",
    "description": null,
    "categories": ["drinks"],
    "prices": [
      { "context": "standard", "amount": 4.00 }
    ],
    "currency": "GBP",
    "spiceLevel": 0,
    "dietary": ["vegan", "gluten-free"],
    "allergens": [],
    "available": true,
    "sortOrder": 12,
    "imageRef": null,
    "imageAlt": null,
    "featured": false,
    "seasonal": false,
    "soldOut": false
  },
  {
    "id": "blackcurrant",
    "slug": "blackcurrant",
    "name": "Blackcurrant",
    "description": null,
    "categories": ["drinks"],
    "prices": [
      { "context": "standard", "amount": 4.00 }
    ],
    "currency": "GBP",
    "spiceLevel": 0,
    "dietary": ["vegan", "gluten-free"],
    "allergens": [],
    "available": true,
    "sortOrder": 13,
    "imageRef": null,
    "imageAlt": null,
    "featured": false,
    "seasonal": false,
    "soldOut": false
  },
  {
    "id": "lemonade",
    "slug": "lemonade",
    "name": "Lemonade",
    "description": null,
    "categories": ["drinks"],
    "prices": [
      { "context": "standard", "amount": 4.00 }
    ],
    "currency": "GBP",
    "spiceLevel": 0,
    "dietary": ["vegan", "gluten-free"],
    "allergens": [],
    "available": true,
    "sortOrder": 14,
    "imageRef": null,
    "imageAlt": null,
    "featured": false,
    "seasonal": false,
    "soldOut": false
  },
  {
    "id": "ginger-beer",
    "slug": "ginger-beer",
    "name": "Ginger Beer",
    "description": null,
    "categories": ["drinks"],
    "prices": [
      { "context": "standard", "amount": 4.00 }
    ],
    "currency": "GBP",
    "spiceLevel": 0,
    "dietary": ["vegan", "gluten-free"],
    "allergens": [],
    "available": true,
    "sortOrder": 15,
    "imageRef": null,
    "imageAlt": null,
    "featured": false,
    "seasonal": false,
    "soldOut": false
  }
]
