[
  {
    "id": "home-style-fish-curry",
    "slug": "home-style-fish-curry",
    "name": "Home Style Fish Curry",
    "description": "Cooked with tomato, onion, garlic, ginger & cumin.",
    "categories": ["seafood-curries"],
    "prices": [
      { "context": "standard", "amount": 15.95 }
    ],
    "currency": "GBP",
    "spiceLevel": 1,
    "dietary": [],
    "allergens": [],
    "available": true,
    "sortOrder": 1,
    "imageRef": null,
    "imageAlt": null,
    "featured": false,
    "seasonal": false,
    "soldOut": false
  },
  {
    "id": "south-indian-monkfish-curry",
    "slug": "south-indian-monkfish-curry",
    "name": "South Indian Monkfish Curry",
    "description": "Coconut, onion and tomato sauce tempered with mustard seeds.",
    "categories": ["seafood-curries"],
    "prices": [
      { "context": "standard", "amount": 16.95 }
    ],
    "currency": "GBP",
    "spiceLevel": 3,
    "dietary": [],
    "allergens": [],
    "available": true,
    "sortOrder": 2,
    "imageRef": null,
    "imageAlt": null,
    "featured": false,
    "seasonal": false,
    "soldOut": false
  },
  {
    "id": "king-prawn-karahi",
    "slug": "king-prawn-karahi",
    "name": "King Prawn Karahi",
    "description": "King prawn cooked in caramelised onions, tomatoes, bell pepper, fresh green chilli and ginger.",
    "categories": ["seafood-curries"],
    "prices": [
      { "context": "standard", "amount": 17.95 }
    ],
    "currency": "GBP",
    "spiceLevel": 2,
    "dietary": [],
    "allergens": [],
    "available": true,
    "sortOrder": 3,
    "imageRef": null,
    "imageAlt": null,
    "featured": false,
    "seasonal": false,
    "soldOut": false
  },
  {
    "id": "seafood-moilee",
    "slug": "seafood-moilee",
    "name": "Seafood Moilee",
    "description": "Squid, scallop, monkfish, mussel and prawn cooked in a coconut and cream based sauce — a South Indian favourite.",
    "categories": ["seafood-curries"],
    "prices": [
      { "context": "standard", "amount": 18.95 }
    ],
    "currency": "GBP",
    "spiceLevel": 1,
    "dietary": [],
    "allergens": [],
    "available": true,
    "sortOrder": 4,
    "imageRef": null,
    "imageAlt": null,
    "featured": false,
    "seasonal": false,
    "soldOut": false
  }
]
