[
  {
    "id": "kids-ice-cream-vanilla",
    "slug": "kids-ice-cream-vanilla",
    "name": "Vanilla Ice Cream",
    "description": null,
    "categories": ["kids"],
    "prices": [],
    "priceOnRequest": true,
    "currency": "GBP",
    "spiceLevel": 0,
    "dietary": ["vegetarian"],
    "allergens": [],
    "available": true,
    "sortOrder": 1,
    "imageRef": null,
    "imageAlt": null,
    "featured": false,
    "seasonal": false,
    "soldOut": false
  },
  {
    "id": "kids-ice-cream-strawberry",
    "slug": "kids-ice-cream-strawberry",
    "name": "Strawberry Ice Cream",
    "description": null,
    "categories": ["kids"],
    "prices": [],
    "priceOnRequest": true,
    "currency": "GBP",
    "spiceLevel": 0,
    "dietary": ["vegetarian"],
    "allergens": [],
    "available": true,
    "sortOrder": 2,
    "imageRef": null,
    "imageAlt": null,
    "featured": false,
    "seasonal": false,
    "soldOut": false
  },
  {
    "id": "kids-ice-cream-chocolate",
    "slug": "kids-ice-cream-chocolate",
    "name": "Chocolate Ice Cream",
    "description": null,
    "categories": ["kids"],
    "prices": [],
    "priceOnRequest": true,
    "currency": "GBP",
    "spiceLevel": 0,
    "dietary": ["vegetarian"],
    "allergens": [],
    "available": true,
    "sortOrder": 3,
    "imageRef": null,
    "imageAlt": null,
    "featured": false,
    "seasonal": false,
    "soldOut": false
  }
]
